{
  "request_id": "11111111-1111-4111-8111-111111111111",
  "transcript": "hello world",
  "raw_transcript": "Hello, world.",
  "confidence": 0.92,
  "ask_repeat": false,
  "selected_backend": "whisper_base_ct2_int8",
  "router_kind": "deterministic_selector",
  "routing_features": {
    "snr_db_est": 23.4,
    "voiced_ratio": 0.71,
    "profile": "balanced"
  },
  "latency_ms": {
    "backend": 240,
    "server": 280,
    "end_to_end": 320
  },
  "cost_usd": 0.0,
  "third_party_provider": null,
  "report_links": {
    "model_card": "",
    "router_card": ""
  },
  "errors": []
}
